{
  "tableStrategy": "single-flat",
  "tables": [
    {
      "name": "netflix_titles",
      "role": "fact",
      "sourceType": "csv",
      "sourceFile": "C:\\Users\\SiddhiVermaMAQSoftwa\\OneDrive - MAQ Software\\Desktop\\Deterministic\\TableauToPBI-Hybrid\\Data\\Netflix\\netflix_titles.csv"
    }
  ],
  "relationships": [],
  "measures": [],
  "calculatedColumns": [
    {
      "table": "netflix_titles",
      "name": "Year",
      "dax": "netflix_titles[date_added]",
      "dataType": "dateTime",
      "formatString": "General Date",
      "description": "Tableau calc field 'Year' = DATETIME([date_added]); a row-level cast of the Date Added column to datetime."
    }
  ],
  "visualDecisions": [],
  "fieldParameters": []
}
